{
  "observation_id": "simulated-quarantined-002",
  "sensor_id": "turbidity_sensor_02",
  "station_id": "lake_county_clear_lake_02",
  "observed_at": "2026-06-25T07:10:00Z",
  "received_at": "2026-06-25T07:15:00Z",
  "parameter": "turbidity",
  "value": -150.0,
  "unit": "NTU",
  "latitude": 39.0210,
  "longitude": -122.8500,
  "source": "lorawan_gateway_main",
  "quality_flag": "quarantined",
  "review_status": "human_review_required",
  "notes": "Simulated example data. Quarantined due to impossible negative turbidity value (-150.0 NTU)."
}
